price,location,geo_lat,geo_lng,metro,floor,floor_count,square,living_square,kitchen_square,year,finish_type,ceiling_height,view,house_type,heating,breakdown,parking,accomodation_type,author,url
11350000,"Москва, ЮАО, р-н Бирюлево Восточное, 6-я Радиальная ул., 7/6к1",55.6055,37.655688,Царицыно,13,18,38.0,15.0,10.0,2021,Евроремонт,2.8,Во двор,Кирпичный,Индивидуальный тепловой пункт,Нет,unknown,Вторичка,unknown,https://www.cian.ru/sale/flat/305233689/
8293627,"Московская область, Одинцовский городской округ, Крюково деревня, ул. Высокая, 1",55.649423,37.173014,Толстопальцево,2,4,37.5,15.9,13.5,2023,Без отделки,3.1,Во двор,Монолитно-кирпичный,unknown,unknown,unknown,Новостройка,unknown,https://odintsovo.cian.ru/sale/flat/302836201/
3290000,"Московская область, Химки городской округ, Брехово деревня, Митино Дальнее микрорайон, 14",55.934623,37.173885,Зеленоград,3,4,30.0,12.0,8.4,2024,unknown,2.7,Во двор,Монолитно-кирпичный,unknown,unknown,unknown,Вторичка,unknown,https://khimki.cian.ru/sale/flat/303187295/
6301350,"Московская область, Химки, мкр. Клязьма-Старбеево, Международный квартал, 1-й Химкинский жилой комплекс",55.9478835100059,37.4680788282465,Водники,2,12,33.5,10.3,12.5,2026,Предчистовая,2.72,unknown,Монолитный,unknown,unknown,unknown,Новостройка,unknown,https://khimki.cian.ru/sale/flat/303577996/
6100000,"Московская область, Видное, ул. Святослава Рихтера, 2",55.537928,37.642995,Бульвар Дмитрия,4,8,31.1,16.0,8.0,2017,Евроремонт,2.7,На улицу и двор,Кирпичный,Центральное,Нет,unknown,Вторичка,unknown,https://vidnoye.cian.ru/sale/flat/306231657/
4150000,"Московская область, Сергиев Посад, мкр. Клементьевский, Вознесенская ул., 109",56.297943,38.132963,unknown,3,5,29.5,15.6,6.0,1977,Косметический,2.7,Во двор,Кирпичный,Центральное,Нет,unknown,Вторичка,unknown,https://sergiyev-posad.cian.ru/sale/flat/306755994/
4250000,"Московская область, Богородский городской округ, Старая Купавна, ул. Трудовая, 19А",55.808887,38.190024,Железнодорожная,5,17,33.25,14.5,9.5,2022,Без ремонта,unknown,unknown,Монолитный,Центральное,Нет,unknown,Вторичка,unknown,https://staraya-kupavna.cian.ru/sale/flat/302376889/
4300000,"Московская область, Химки городской округ, Брехово деревня, Митино Дальнее микрорайон, 13",55.934618,37.17455,unknown,1,4,28.2,18.0,8.0,2023,Без ремонта,2.7,Во двор,Монолитный,unknown,unknown,unknown,Вторичка,unknown,https://khimki.cian.ru/sale/flat/303473429/
4700000,"Московская область, Домодедово городской округ, Домодедово село, ул. Высотная, 9",55.471602,37.701062,Щербинка,12,17,36.0,18.0,10.0,2022,Без ремонта,unknown,На улицу,Монолитный,Центральное,Нет,unknown,Вторичка,unknown,https://domodedovo.cian.ru/sale/flat/306187746/
4800000,"Московская область, Солнечногорск, ул. Баранова, 5",56.183498,36.977729,unknown,5,5,31.5,18.0,6.5,1965,Дизайнерский,2.5,Во двор,Кирпичный,Центральное,Нет,unknown,Вторичка,unknown,https://solnechnogorsk.cian.ru/sale/flat/306881231/
4800000,"Московская область, Солнечногорск, ул. Баранова, 5",56.183498,36.977729,unknown,5,5,31.5,18.0,6.5,1966,Евроремонт,2.6,Во двор,Кирпичный,Центральное,Нет,unknown,Вторичка,unknown,https://solnechnogorsk.cian.ru/sale/flat/306465471/
4800000,"Московская область, Богородский городской округ, Щемилово деревня, ул. Орлова, 26",55.806575,38.090374,Кучино,10,12,31.5,17.0,7.0,2016,Евроремонт,2.7,На улицу,unknown,Центральное,Нет,unknown,Вторичка,unknown,https://noginsk.cian.ru/sale/flat/306141626/
4900000,"Московская область, Люберцы, мкр. Люберцы 2015 2018, Зенино ЖК Самолет микрорайон, ул. Вертолетная, 46",55.696357,37.960567,Некрасовка,17,17,29.4,10.0,8.9,2018,Косметический,2.7,На улицу,Кирпичный,Индивидуальный тепловой пункт,Нет,unknown,Вторичка,unknown,https://lyubertsy.cian.ru/sale/flat/300950776/
5200000,"Московская область, Балашиха, мкр. Саввино, ул. Безымянная, 6",55.741541,38.039637,Некрасовка,12,17,31.8,16.8,10.0,2022,Косметический,2.65,На улицу,unknown,Нет информации,Нет,unknown,Вторичка,unknown,https://balashikha.cian.ru/sale/flat/304067431/
5200000,"Московская область, Химки, мкр. Новогорск, 2",55.891895,37.346605,Пятницкое шоссе,3,5,31.1,unknown,6.0,1964,Косметический,2.7,Во двор,unknown,Нет информации,Нет,unknown,Вторичка,unknown,https://khimki.cian.ru/sale/flat/304957462/
5200000,"Московская область, Лосино-Петровский городской округ, Свердловский рп, ул. Строителей, 12",55.900971,38.148674,unknown,12,16,38.2,18.0,9.0,2014,Евроремонт,unknown,Во двор,unknown,Индивидуальный тепловой пункт,Нет,unknown,Вторичка,unknown,https://losino-petrovskiy.cian.ru/sale/flat/280937989/
5280000,"Московская область, Солнечногорск городской округ, Андреевка рп, ул. Староандреевская, 43к2",55.984194,37.131871,Зеленоград,13,17,30.0,16.0,7.0,2015,Дизайнерский,2.7,Во двор,Монолитный,Автономная котельная,Нет,unknown,Вторичка,unknown,https://solnechnogorsk.cian.ru/sale/flat/299832015/
5300000,"Московская область, Ленинский городской округ, Володарского поселок, Зеленая ул., 43",55.502477,37.947694,Удельная,8,10,40.9,20.0,10.0,2013,Косметический,unknown,На улицу,Панельный,Центральное,Нет,unknown,Вторичка,unknown,https://vidnoye.cian.ru/sale/flat/294469337/
5300000,"Москва, ТАО (Троицкий), Кленовское поселение, Витро Вилладж База отдыха, к1",55.336165,37.325827,unknown,1,5,35.6,20.6,10.0,2014,Дизайнерский,3.5,Во двор,Монолитно-кирпичный,unknown,unknown,unknown,Вторичка / Апартаменты,unknown,https://www.cian.ru/sale/flat/303513705/
5365753,"Московская область, Дмитровский городской округ, Рыбаки деревня, Зеленый Город жилой комплекс",56.0606088363197,37.355606806854,Лобня,3,5,36.89,unknown,unknown,2025,Чистовая,unknown,unknown,Кирпичный,unknown,unknown,unknown,Новостройка,unknown,https://dmitrov.cian.ru/sale/flat/306361551/
5475000,"Московская область, Видное, бул. Мстислава Ростроповича, 4к1",55.537342,37.648367,Бульвар Дмитрия,7,8,34.7,16.0,9.0,2022,Без ремонта,2.8,Во двор,Монолитно-кирпичный,unknown,unknown,unknown,Вторичка,unknown,https://vidnoye.cian.ru/sale/flat/306199872/
5499999,"Московская область, Щелково, Потаповский микрорайон, 1к2",55.90959,38.048665,Щёлковская,1,18,41.0,19.0,9.0,2017,Косметический,unknown,Во двор,Блочный,Автономная котельная,Нет,unknown,Вторичка,unknown,https://shchyolkovo.cian.ru/sale/flat/299409162/
5599000,"Московская область, Мытищи, мкр. 5, ул. Терешковой, 12",55.907813,37.729458,Медведково,1,5,30.0,18.0,6.0,1961,Евроремонт,2.5,unknown,Кирпичный,Автономная котельная,Нет,unknown,Вторичка,unknown,https://mytishchi.cian.ru/sale/flat/304090457/
5500000,"Московская область, Щелково, мкр. Центральный, Краснознаменская ул., 6",55.915437,37.996599,Щёлковская,5,5,32.0,17.0,5.5,1974,Косметический,unknown,Во двор,Кирпичный,Центральное,Нет,unknown,Вторичка,unknown,https://shchyolkovo.cian.ru/sale/flat/306954142/
5600700,"Московская область, Балашиха, мкр. Железнодорожный, ул. Лесопарковая, 18",55.752977,38.00021,Железнодорожная,12,17,39.1,19.2,7.5,2016,Без ремонта,2.7,На улицу,Панельный,Центральное,Нет,unknown,Вторичка,unknown,https://balashikha.cian.ru/sale/flat/305671930/
5690000,"Московская область, Балашиха, мкр. Железнодорожный, ул. Струве, 7",55.739286,37.996437,Железнодорожная,8,17,41.7,22.0,9.5,2015,Без ремонта,2.7,Во двор,Панельный,Центральное,Нет,unknown,Вторичка,unknown,https://balashikha.cian.ru/sale/flat/306276343/
5749000,"Московская область, Балашиха, мкр. Новое Павлино, ул. Романычева, 3",55.723207,37.971455,Некрасовка,14,23,32.5,17.0,8.5,2022,Евроремонт,2.8,Во двор,Монолитный,Индивидуальный тепловой пункт,Нет,unknown,Вторичка,unknown,https://balashikha.cian.ru/sale/flat/298992857/
5700000,"Московская область, Дмитров, Московская ул., 21",56.335236,37.512802,unknown,6,12,38.2,unknown,10.0,2022,Без ремонта,unknown,unknown,unknown,Нет информации,Нет,unknown,Вторичка,unknown,https://dmitrov.cian.ru/sale/flat/306317747/
5700000,"Московская область, Власиха поселок, ул. Заозерная, 17",55.680473,37.178898,Одинцово,3,5,36.5,18.7,9.0,1989,Косметический,2.52,Во двор,Панельный,Центральное,Нет,unknown,Вторичка,unknown,https://www.cian.ru/sale/flat/301333265/
5800000,"Московская область, Одинцовский городской округ, Звенигород, Введенское квартал, 1Б",55.702764,36.875815,unknown,4,12,42.0,27.0,10.0,2018,Евроремонт,2.85,Во двор,Монолитный,Индивидуальный тепловой пункт,Нет,unknown,Вторичка,unknown,https://zvenigorod.cian.ru/sale/flat/303487606/
5876400,"Московская область, Красногорск, мкр. Теплый бетон, Речная ул., 20к4",55.836226,37.323976,Митино,2,20,29.2,20.0,7.0,2008,Евроремонт,3.0,На улицу,Монолитный,Центральное,Нет,unknown,Вторичка / Апартаменты,unknown,https://krasnogorsk.cian.ru/sale/flat/302547517/
5880000,"Московская область, Красногорск городской округ, Сабурово деревня, ул. Рождественская, 1",55.873349,37.254482,Пятницкое шоссе,7,8,32.5,unknown,9.5,2022,Евроремонт,2.7,unknown,unknown,Нет информации,Нет,unknown,Вторичка,unknown,https://krasnogorsk.cian.ru/sale/flat/306572835/
5950000,"Московская область, Богородский городской округ, Старая Купавна, ул. Кирова, 21",55.801779,38.183098,Железнодорожная,7,17,34.0,unknown,6.0,2017,Евроремонт,unknown,unknown,Панельный,Центральное,Нет,unknown,Вторичка,unknown,https://staraya-kupavna.cian.ru/sale/flat/305666538/
5900000,"Московская область, Ленинский городской округ, Развилка поселок, 2а",55.591299,37.75073,Домодедовская,3,5,29.8,16.8,8.0,1967,Косметический,unknown,unknown,Кирпичный,Центральное,Нет,unknown,Вторичка,unknown,https://vidnoye.cian.ru/sale/flat/304577450/
5900000,"Москва, ТАО (Троицкий), Кленовское поселение, Витро Вилладж База отдыха, к1",55.336165,37.325827,unknown,1,5,39.5,24.5,10.0,2014,Дизайнерский,3.5,Во двор,Монолитно-кирпичный,unknown,unknown,unknown,Вторичка / Апартаменты,unknown,https://www.cian.ru/sale/flat/303478874/
5900000,"Московская область, Люберцы, мкр. Люберцы 2015 2018, Зенино ЖК Самолет микрорайон, ул. Вертолетная, 24",55.703008,37.966307,Некрасовка,2,17,29.6,16.3,8.3,2016,Косметический,2.7,На улицу,Кирпичный,Индивидуальный тепловой пункт,Нет,unknown,Вторичка,unknown,https://lyubertsy.cian.ru/sale/flat/305151231/
5990000,"Московская область, Пушкино, мкр. Новое Пушкино, к27",56.0250883596727,37.8650447857348,unknown,9,13,31.04,12.3,10.0,2024,Чистовая,unknown,Во двор,Монолитный,unknown,unknown,unknown,Новостройка,unknown,https://pushkino.cian.ru/sale/flat/301620059/
6000000,"Московская область, Домодедово, ул. Курыжова, 14к1",55.398191,37.768777,Подольск,14,17,38.0,10.0,18.0,2016,Евроремонт,2.7,На улицу,unknown,Центральное,Нет,unknown,Вторичка,unknown,https://domodedovo.cian.ru/sale/flat/304591004/
6100000,"Московская область, Люберцы, 1-й Лермонтовский жилой комплекс, к3.1",55.6802755607121,37.9178956531233,Люберцы,7,24,24.5,13.1,6.9,2023,Чистовая,unknown,unknown,Монолитный,unknown,unknown,unknown,Новостройка,unknown,https://lyubertsy.cian.ru/sale/flat/294664286/
6100000,"Московская область, Ленинский городской округ, Лопатино рп, ул. Сухановская, 17",55.532497,37.639294,Бульвар Дмитрия,1,9,32.1,17.9,9.2,2018,Дизайнерский,2.5,На улицу,Панельный,Центральное,Нет,unknown,Вторичка,unknown,https://vidnoye.cian.ru/sale/flat/305741247/
6150000,"Московская область, Видное, Новый микрорайон, 5",55.549633,37.660862,Бульвар Дмитрия,4,5,30.0,10.0,10.0,2015,Евроремонт,2.6,На улицу,unknown,Нет информации,Нет,unknown,Вторичка,unknown,https://vidnoye.cian.ru/sale/flat/306784690/
6190000,"Московская область, Солнечногорск, Красная ул., 127",56.196797,36.961569,unknown,10,16,40.0,15.0,12.3,2018,Косметический,2.8,Во двор,Кирпичный,Центральное,Нет,unknown,Вторичка,unknown,https://solnechnogorsk.cian.ru/sale/flat/303280980/
6190000,"Московская область, Красногорск городской округ, Глухово деревня, ул. Романовская, 5",55.766962,37.236651,Павшино,2,8,27.0,unknown,9.0,2022,Дизайнерский,2.6,Во двор,Монолитный,Центральное,Нет,unknown,Вторичка,unknown,https://krasnogorsk.cian.ru/sale/flat/301194204/
6199000,"Московская область, Дмитров, Оборонная ул., 32",56.354742,37.53181,unknown,11,17,42.9,unknown,12.0,2021,Евроремонт,unknown,На улицу,unknown,Нет информации,Нет,unknown,Вторичка,unknown,https://dmitrov.cian.ru/sale/flat/306654559/
6200000,"Московская область, Ленинский городской округ, Развилка поселок, проезд Римский, 7",55.5978087709235,37.7695166100856,Зябликово,3,16,39.5,16.3,10.4,2024,Без отделки,unknown,Во двор,Монолитный,unknown,unknown,unknown,Новостройка,unknown,https://vidnoye.cian.ru/sale/flat/294304447/
6200000,"Москва, СВАО, р-н Отрадное, Алтуфьевское ш., 2",55.849221,37.586607,Владыкино,9,16,19.0,14.0,3.0,1980,Евроремонт,2.7,Во двор,Блочный,unknown,unknown,unknown,Вторичка / Апартаменты,unknown,https://www.cian.ru/sale/flat/306448085/
6200000,"Московская область, Красногорск, мкр. СГШ, Железнодорожная ул., 7",55.814644,37.329519,Павшино,9,9,30.8,19.8,6.0,1971,Без ремонта,unknown,На улицу и двор,Кирпичный,Центральное,Нет,unknown,Вторичка,unknown,https://krasnogorsk.cian.ru/sale/flat/306799426/
6200000,"Московская область, Химки, мкр. Сходня, Железнодорожная ул., 33к2",55.947227,37.316852,Сходня,3,17,37.0,unknown,12.5,2020,Косметический,unknown,unknown,Блочный,Центральное,Нет,unknown,Вторичка,unknown,https://khimki.cian.ru/sale/flat/300664625/
6299000,"Московская область, Дмитров, Оборонная ул., 32",56.354742,37.53181,unknown,11,17,42.9,17.0,12.0,2021,Евроремонт,unknown,На улицу,unknown,Нет информации,Нет,unknown,Вторичка,unknown,https://dmitrov.cian.ru/sale/flat/306604074/
6300000,"Московская область, Сергиев Посад, мкр. Северный, просп. Красной Армии, 251а",56.33314,38.155969,Щёлковская,3,17,31.0,18.0,8.0,2013,Евроремонт,2.7,Во двор,Кирпичный,Центральное,Нет,unknown,Вторичка,unknown,https://sergiyev-posad.cian.ru/sale/flat/304411279/
6300000,"Московская область, Дмитров, Имени В.Н. Махалина микрорайон, 27",56.357918,37.537919,unknown,6,14,43.0,19.0,11.0,2012,Евроремонт,2.7,Во двор,Кирпичный,Центральное,Нет,unknown,Вторичка,unknown,https://dmitrov.cian.ru/sale/flat/299420284/
6499999,"Московская область, Балашиха, мкр. Новое Павлино, ул. Троицкая, 2",55.727526,37.97441,Некрасовка,15,19,42.5,20.0,11.0,2013,Евроремонт,2.7,На улицу,Кирпичный,Центральное,Нет,unknown,Вторичка,unknown,https://balashikha.cian.ru/sale/flat/304577496/
6450000,"Московская область, Балашиха, мкр. Железнодорожный, просп. Героев, 9",55.739934,38.003677,Железнодорожная,15,19,42.5,17.1,13.3,2016,Без ремонта,2.7,На улицу,Монолитный,Центральное,Нет,unknown,Вторичка,unknown,https://balashikha.cian.ru/sale/flat/304791967/
6400000,"Московская область, Балашиха, мкр. Железнодорожный, просп. Героев, 9",55.739934,38.003677,Железнодорожная,9,25,44.2,19.0,12.1,2016,Без ремонта,2.7,На улицу,Монолитный,Центральное,Нет,unknown,Вторичка,unknown,https://balashikha.cian.ru/sale/flat/304792823/
6500000,"Московская область, Лыткарино, 3-й микрорайон, 3А квартал, ул. Степана Степанова, 2",55.589142,37.908564,Котельники,2,17,45.2,16.0,12.0,2004,Евроремонт,2.75,unknown,unknown,Индивидуальный тепловой пункт,Нет,unknown,Вторичка,unknown,https://lytkarino.cian.ru/sale/flat/306777082/
6500000,"Московская область, Люберцы, мкр. Люберцы 2015 2018, Зенино ЖК Самолет микрорайон, ул. Барыкина, 4",55.707618,37.956363,Некрасовка,3,20,38.7,14.6,11.7,2015,Евроремонт,2.7,Во двор,Кирпичный,Центральное,Нет,unknown,Вторичка,unknown,https://lyubertsy.cian.ru/sale/flat/306945158/
6500000,"Московская область, Красногорск городской округ, Глухово деревня, ул. Романовская, 13",55.766537,37.240666,Павшино,6,8,37.35,unknown,12.0,2022,Без ремонта,2.7,На улицу,Монолитный,Центральное,Нет,unknown,Вторичка,unknown,https://krasnogorsk.cian.ru/sale/flat/306394565/
6500000,"Московская область, Солнечногорск городской округ, Голубое деревня, бул. Парковый, 5А",55.976075,37.097699,Зеленоград,21,26,40.0,15.0,11.0,2021,Косметический,2.85,На улицу,Монолитный,Центральное,Нет,unknown,Вторичка,unknown,https://solnechnogorsk.cian.ru/sale/flat/306235330/
6550000,"Московская область, Солнечногорск, Рекинцо-2 микрорайон, 3",56.178503,37.002172,unknown,11,17,43.9,25.0,8.0,2007,Евроремонт,2.7,Во двор,Кирпичный,Центральное,Нет,unknown,Вторичка,unknown,https://solnechnogorsk.cian.ru/sale/flat/306910246/
6600000,"Московская область, Раменское, ул. Крымская, 5",55.574162,38.257748,Ипподром,14,17,41.5,17.7,13.1,2017,Без ремонта,2.8,Во двор,Монолитный,Центральное,Нет,unknown,Вторичка,unknown,https://ramenskoye.cian.ru/sale/flat/303028543/
6600000,"Московская область, Люберцы, мкр. Люберцы 2015 2018, Зенино ЖК Самолет микрорайон, ул. Вертолетная, 14к2",55.706259,37.962822,Некрасовка,16,17,35.8,15.0,8.0,2016,Евроремонт,2.8,На улицу и двор,Кирпичный,Индивидуальный тепловой пункт,Нет,unknown,Вторичка,unknown,https://lyubertsy.cian.ru/sale/flat/301122180/
6730000,"Московская область, Котельники, Южный микрорайон, 5а",55.647645,37.861627,Котельники,3,17,38.5,18.9,7.4,2007,Косметический,2.6,Во двор,Панельный,Центральное,Нет,unknown,Вторичка,unknown,https://kotelniki.cian.ru/sale/flat/296747486/
6700000,"Московская область, Ленинский городской округ, Лопатино рп, бул. Солнечный, 13",55.531453,37.643597,Бульвар Дмитрия,2,9,33.5,14.5,10.0,2019,Евроремонт,2.65,Во двор,Панельный,Центральное,Нет,unknown,Вторичка,unknown,https://vidnoye.cian.ru/sale/flat/306661656/
6700000,"Московская область, Пушкинский городской округ, Ивантеевка, Голландский квартал микрорайон, 3",55.971491,37.872532,unknown,3,4,30.9,12.8,unknown,2015,unknown,unknown,unknown,Блочный,Автономная котельная,Нет,unknown,Вторичка,unknown,https://ivanteyevka.cian.ru/sale/flat/305375723/
6700000,"Московская область, Королев, мкр. Мичурина, ул. Мичурина, 27к2",55.905058,37.844451,Щёлковская,5,17,43.8,18.2,unknown,2003,Евроремонт,unknown,unknown,Монолитный,Центральное,Нет,unknown,Вторичка,unknown,https://korolev.cian.ru/sale/flat/287840799/
6700000,"Москва, НАО (Новомосковский), Рязановское поселение, ул. Уточкина, 7к1",55.475169,37.525208,Бунинская аллея,6,14,30.0,9.7,12.6,2022,Без ремонта,unknown,На улицу,Монолитный,Индивидуальный тепловой пункт,Нет,unknown,Вторичка,unknown,https://www.cian.ru/sale/flat/306923760/
6650000,"Московская область, Ленинский городской округ, Лопатино рп, ул. Сухановская, 6",55.536711,37.634218,Бульвар Дмитрия,4,10,40.7,19.0,11.0,2017,Евроремонт,unknown,На улицу,Панельный,Центральное,Нет,unknown,Вторичка,unknown,https://vidnoye.cian.ru/sale/flat/305392061/
