price,location,geo_lat,geo_lng,metro,floor,floor_count,square,living_square,kitchen_square,year,finish_type,ceiling_height,view,house_type,heating,breakdown,parking,accomodation_type,author,url
18374400,"Москва, СВАО, р-н Марьина роща, Тэйт жилой комплекс",55.8025300783107,37.62094537252544,Марьина Роща,34,49,38.28,11.8,unknown,2027,Предчистовая,3.12,unknown,Монолитно-кирпичный,unknown,unknown,unknown,Новостройка,КОРТРОС,https://www.cian.ru/sale/flat/302789697/
49954800,"Москва, ЦАО, р-н Таганский, Славянская пл., 2/5с1",55.752541,37.635727,Китай,7,8,53.2,unknown,24.1,2022,Евроремонт,3.0,unknown,Монолитно-кирпичный,unknown,unknown,unknown,Вторичка / Апартаменты,unknown,https://www.cian.ru/sale/flat/301496936/
8170000,"Москва, НАО (Новомосковский), Филимонковское поселение, ул. Жемчужная, 1к4",55.552637,37.337172,Филатов Луг,2,5,31.0,unknown,10.0,2021,Дизайнерский,3.0,Во двор,unknown,Нет информации,Нет,unknown,Вторичка,unknown,https://www.cian.ru/sale/flat/303552909/
20206500,"Москва, СВАО, р-н Останкинский, ул. Годовикова, 11к5",55.810466,37.624247,Алексеевская,34,37,28.5,21.4,unknown,2024,"Без отделки, предчистовая, чистовая",3.01,На улицу,Монолитно-кирпичный,unknown,unknown,unknown,Новостройка,КОРТРОС,https://www.cian.ru/sale/flat/306568424/
17119620,"Москва, ЮАО, р-н Даниловский, Автозаводская ул., 26",55.70659736274,37.6322846801478,Тульская,6,20,38.82,10.6,18.6,2024,unknown,2.85,Во двор,Монолитный,unknown,unknown,unknown,Новостройка,unknown,https://www.cian.ru/sale/flat/305679800/
7550000,"Москва, НАО (Новомосковский), Филимонковское поселение, ул. Жемчужная, 1к14",55.551456,37.339499,Филатов Луг,2,5,30.0,15.0,9.0,2021,Дизайнерский,2.8,Во двор,unknown,Нет информации,Нет,unknown,Вторичка,unknown,https://www.cian.ru/sale/flat/306451520/
14757511,"Москва, СЗАО, р-н Покровское-Стрешнево, Волоколамское ш., 95/1к6",55.829921,37.406711,Трикотажная,2,27,40.1,12.9,unknown,2027,Предчистовая,2.85,Во двор,Монолитно-кирпичный,unknown,unknown,unknown,Новостройка,MR Group,https://www.cian.ru/sale/flat/306515308/
36000000,"Москва, САО, р-н Хорошевский, Ленинградский просп., 37/4",55.793313,37.540533,ЦСКА,5,40,40.0,unknown,unknown,2021,Дизайнерский,3.2,На улицу и двор,Монолитный,Центральное,Нет,unknown,Вторичка,unknown,https://www.cian.ru/sale/flat/304681968/
9000000,"Москва, НАО (Новомосковский), Внуковское поселение, ул. Летчика Грицевца, 7",55.62301,37.307411,Пыхтино,4,17,37.1,unknown,7.3,2013,Косметический,unknown,На улицу,Панельный,Индивидуальный тепловой пункт,Нет,unknown,Вторичка,unknown,https://www.cian.ru/sale/flat/306808870/
5994720,"Московская область, Одинцовский городской округ, Перхушково село, Равновесие микрорайон",55.6538848796601,37.1203557553635,Толстопальцево,2,6,36.2,13.8,unknown,2026,"Без отделки, предчистовая, черновая, чистовая",2.7,unknown,Монолитно-кирпичный,unknown,unknown,unknown,Новостройка,КОРТРОС,https://odintsovo.cian.ru/sale/flat/301555506/
28100000,"Москва, ЦАО, р-н Пресненский, Ходынская ул., 2",55.770806,37.564212,Улица 1905 года,2,44,57.0,44.0,8.0,2018,Дизайнерский,unknown,На улицу,Монолитный,Индивидуальный тепловой пункт,Нет,unknown,Вторичка / Апартаменты,unknown,https://www.cian.ru/sale/flat/298880305/
10800000,"Москва, ЮАО, р-н Даниловский, Автозаводская ул., 23С928",55.702313,37.640632,Автозаводская,3,4,45.0,unknown,10.0,unknown,Дизайнерский,unknown,Во двор,unknown,unknown,unknown,unknown,Вторичка / Апартаменты,unknown,https://www.cian.ru/sale/flat/303618522/
78259545,"Москва, ЦАО, р-н Пресненский, ул. Костикова, 4к1",55.7612846731082,37.5573009849619,Улица 1905 года,5,21,65.9,18.8,24.9,2023,"Чистовая, чистовая с мебелью",3.0,На улицу,Монолитный,unknown,unknown,unknown,Новостройка,VESPER,https://www.cian.ru/sale/flat/306541560/
30900000,"Москва, ЗАО, р-н Раменки, Винницкая ул., 8к3",55.700983,37.493479,Раменки,15,28,40.0,unknown,18.0,2022,Дизайнерский,3.12,На улицу,Монолитный,Индивидуальный тепловой пункт,Нет,unknown,Вторичка,unknown,https://www.cian.ru/sale/flat/306537307/
11900000,"Москва, СВАО, р-н Отрадное, Юрловский проезд, 14к1",55.877788,37.613566,Бибирево,8,17,37.0,19.0,7.1,2011,Косметический,2.74,На улицу и двор,Панельный,Автономная котельная,Нет,unknown,Вторичка,unknown,https://www.cian.ru/sale/flat/303859491/
134746500,"Москва, ЦАО, р-н Тверской, 1-я Тверская-Ямская ул., 2",55.7710883704405,37.5948676266339,Маяковская,7,9,93.9,unknown,41.3,2023,"Без отделки, чистовая с мебелью",unknown,unknown,Монолитный,unknown,unknown,unknown,Новостройка / Апартаменты,VESPER,https://www.cian.ru/sale/flat/306599727/
32000000,"Москва, САО, р-н Хорошевский, Ленинградский просп., 37/4",55.793313,37.540533,ЦСКА,9,40,41.5,23.4,4.9,2021,unknown,unknown,На улицу и двор,Монолитный,Центральное,Нет,unknown,Вторичка,unknown,https://www.cian.ru/sale/flat/299890518/
14990000,"Москва, ЮВАО, р-н Нижегородский, Газгольдерная ул., 10",55.727192,37.735746,Нижегородская,24,25,39.0,unknown,16.0,2023,Дизайнерский,2.6,На улицу и двор,unknown,Нет информации,Нет,unknown,Вторичка,unknown,https://www.cian.ru/sale/flat/306525090/
29486364,"Москва, САО, р-н Беговой, Ленинградский просп., вл8",55.78085421861,37.5826308664078,Белорусская,3,36,40.8,unknown,unknown,2027,Без отделки,3.08,На улицу и двор,Монолитный,unknown,unknown,unknown,Новостройка,MR Group,https://www.cian.ru/sale/flat/306603306/
27000000,"Москва, СЗАО, р-н Хорошево-Мневники, Шелепихинская наб., 34к5",55.764496,37.51149,Шелепиха,6,42,42.0,17.0,11.0,2023,Дизайнерский,3.2,Во двор,unknown,Нет информации,Нет,unknown,Вторичка,unknown,https://www.cian.ru/sale/flat/307014462/
4960000,"Москва, СВАО, р-н Марфино, Малая Ботаническая ул., 10А",55.833016,37.588817,Фонвизинская,4,4,16.0,11.0,3.0,1961,Евроремонт,2.8,Во двор,Кирпичный,unknown,unknown,unknown,Вторичка / Апартаменты,unknown,https://www.cian.ru/sale/flat/305916876/
57190400,"Москва, ЦАО, р-н Замоскворечье, Космодамианская наб., 4/22С9",55.74569749148403,37.63821427116283,Новокузнецкая,4,6,51.2,12.3,23.9,2024,Без отделки,3.23,На улицу и двор,Монолитно-кирпичный,unknown,unknown,unknown,Новостройка / Апартаменты,Галс-Девелопмент,https://www.cian.ru/sale/flat/303040427/
25499999,"Москва, СЗАО, р-н Хорошево-Мневники, ул. Народного Ополчения, 13",55.772943,37.472899,Народное Ополчение,10,21,45.5,15.2,14.9,2023,Косметический,3.0,Во двор,Монолитный,unknown,unknown,unknown,Вторичка / Апартаменты,unknown,https://www.cian.ru/sale/flat/275914039/
3050000,"Москва, ЮЗАО, р-н Южное Бутово, ул. Поляны, 5",55.55777,37.555023,Улица Скобелевская,3,31,10.7,3.7,2.0,2018,unknown,unknown,unknown,unknown,Индивидуальный тепловой пункт,Нет,unknown,Вторичка / Апартаменты,unknown,https://www.cian.ru/sale/flat/303456153/
17650549,"Москва, ЮЗАО, р-н Котловка, Новые Академики жилой комплекс, 31/2",55.6739946442631,37.581941424605,Нахимовский проспект,2,8,35.92,20.9,5.1,2027,Без отделки,3.4,unknown,Монолитный,unknown,unknown,unknown,Новостройка,Главстрой,https://www.cian.ru/sale/flat/301772288/
20268000,"Москва, СЗАО, р-н Хорошево-Мневники, Шелепихинская наб., 40к1",55.766997,37.501753,Народное Ополчение,32,43,37.2,15.7,13.7,2023,Без ремонта,3.15,На улицу и двор,unknown,Нет информации,Нет,unknown,Вторичка,unknown,https://www.cian.ru/sale/flat/303547369/
1350000,"Московская область, Сергиево-Посадский городской округ, Путятино деревня, 133",56.3404,38.35446,unknown,1,5,31.1,12.0,9.0,1984,Косметический,unknown,На улицу,Панельный,Центральное,Нет,unknown,Вторичка,unknown,https://www.cian.ru/sale/flat/303274440/
129089700,"Москва, ЦАО, р-н Мещанский, Садовая-Сухаревская ул., 14",55.772993,37.627391,Сухаревская,6,13,85.04,45.8,15.8,2025,Чистовая,3.6,На улицу и двор,Монолитно-кирпичный,unknown,unknown,unknown,Новостройка,MR Group,https://www.cian.ru/sale/flat/306186195/
31500000,"Москва, САО, р-н Хорошевский, Ленинградский просп., 37/4",55.793313,37.540533,ЦСКА,16,38,41.1,23.0,5.0,2021,Дизайнерский,3.2,На улицу,Монолитный,Центральное,Нет,unknown,Вторичка,unknown,https://www.cian.ru/sale/flat/306867070/
31500000,"Москва, САО, р-н Хорошевский, Ленинградский просп., 37/4",55.793313,37.540533,ЦСКА,16,40,41.1,23.4,4.9,2021,unknown,unknown,На улицу и двор,Монолитный,Центральное,Нет,unknown,Вторичка,unknown,https://www.cian.ru/sale/flat/292933473/
20884900,"Москва, ЦАО, р-н Басманный, ул. Фридриха Энгельса, 56",55.7767727415349,37.6924907546307,Бауманская,2,27,45.7,26.8,7.8,2026,"Без отделки, чистовая",3.25,Во двор,Монолитно-кирпичный,unknown,unknown,unknown,Новостройка,Галс-Девелопмент,https://www.cian.ru/sale/flat/306243017/
16500000,"Москва, СВАО, р-н Останкинский, ул. Цандера, 4К2",55.817264,37.63102,ВДНХ,6,12,38.0,19.0,11.0,1967,Дизайнерский,2.65,Во двор,Блочный,Центральное,Нет,unknown,Вторичка,unknown,https://www.cian.ru/sale/flat/305550068/
20800000,"Москва, ЮАО, р-н Даниловский, Дубининская ул., 59к7",55.7173634696842,37.6364943993748,Серпуховская,29,42,38.1,13.1,14.7,2024,unknown,3.0,На улицу,Монолитный,unknown,unknown,unknown,Новостройка,unknown,https://www.cian.ru/sale/flat/305501331/
18560670,"Москва, ЗАО, Рублево-Архангельское микрорайон, Сберсити жилой комплекс, В17 квартал",55.78928892619544,37.34223375401157,Опалиха,3,7,41.7,14.2,15.2,2026,"Без отделки, чистовая",unknown,unknown,Монолитно-кирпичный,unknown,unknown,unknown,Новостройка,Рублево-Архангельское,https://www.cian.ru/sale/flat/301919899/
63000000,"Москва, ЦАО, р-н Пресненский, 1-й Красногвардейский проезд, 22с1",55.751138,37.533742,Деловой центр,24,79,72.0,50.0,15.0,2019,Дизайнерский,unknown,На улицу и двор,Монолитный,unknown,unknown,unknown,Вторичка / Апартаменты,unknown,https://www.cian.ru/sale/flat/301042658/
26155305,"Москва, ЗАО, Рублево-Архангельское микрорайон, Сберсити жилой комплекс, В21 квартал",55.7875762516888,37.3434570638689,Опалиха,4,13,56.43,16.4,21.3,2025,"Без отделки, чистовая",4.1,На улицу,Монолитный,unknown,unknown,unknown,Новостройка,Рублево-Архангельское,https://www.cian.ru/sale/flat/306151922/
25000000,"Москва, ЦАО, р-н Пресненский, Шмитовский проезд, 39к2",55.754061,37.524722,Шелепиха,19,32,32.2,unknown,unknown,2019,Дизайнерский,3.0,На улицу и двор,Монолитный,Центральное,Нет,unknown,Вторичка,unknown,https://www.cian.ru/sale/flat/303071841/
18500000,"Москва, ЮЗАО, р-н Обручевский, ул. Академика Волгина, 2С2",55.6560485847175,37.5223552771048,Калужская,28,47,34.4,18.5,8.2,2024,Чистовая,unknown,На улицу и двор,Монолитный,unknown,unknown,unknown,Новостройка,unknown,https://www.cian.ru/sale/flat/304298213/
23508375,"Москва, ЗАО, Рублево-Архангельское микрорайон, Сберсити жилой комплекс, В19 квартал",55.789558187273,37.3438052008762,Павшино,4,12,45.87,13.4,15.1,2024,Без отделки,3.83,unknown,Монолитный,unknown,unknown,unknown,Новостройка,Рублево-Архангельское,https://www.cian.ru/sale/flat/299137613/
4150000,"Московская область, Пушкинский городской округ, Тарасовка село, ул. Пожидаева, 18к4",55.965043,37.816837,unknown,4,5,32.0,19.5,7.0,1982,Косметический,unknown,Во двор,unknown,Нет информации,Нет,unknown,Вторичка,unknown,https://ivanteyevka.cian.ru/sale/flat/305496725/
12990000,"Москва, ЦАО, р-н Таганский, ул. Талалихина, 3",55.734207,37.679978,Пролетарская,1,12,38.9,21.0,9.0,1978,Косметический,unknown,Во двор,unknown,Центральное,Нет,unknown,Вторичка,unknown,https://www.cian.ru/sale/flat/305881394/
13843599,"Москва, ЗАО, р-н Кунцево, 48-й квартал, Кутузовский Квартал жилой комплекс",55.728900591784566,37.43294646961893,Кунцевская,2,44,31.61,9.4,11.9,2027,"Без отделки, предчистовая",2.92,unknown,Монолитный,unknown,unknown,unknown,Новостройка,Среда,https://www.cian.ru/sale/flat/304753663/
13500000,"Москва, ЗАО, р-н Раменки, ул. Лобачевского, 100К3",55.685274,37.483041,Мичуринский проспект,1,16,37.5,21.0,8.9,1981,Евроремонт,2.64,Во двор,Панельный,Центральное,Нет,unknown,Вторичка,unknown,https://www.cian.ru/sale/flat/304885992/
19000000,"Москва, ЮЗАО, р-н Обручевский, ул. Академика Волгина, 2С2",55.6560485847175,37.5223552771048,Беляево,4,46,39.7,9.6,15.9,2024,Чистовая,unknown,unknown,Монолитный,unknown,unknown,unknown,Новостройка,unknown,https://www.cian.ru/sale/flat/298087113/
22374675,"Москва, ЗАО, р-н Филевский парк, Береговой проезд, 2",55.7597681819349,37.5078063512008,Фили,2,16,45.0,16.4,14.6,2024,Без отделки,3.2,На улицу,Монолитно-кирпичный,unknown,unknown,unknown,Новостройка,Главстрой,https://www.cian.ru/sale/flat/296921064/
20018250,"Москва, ЮАО, р-н Даниловский, Автозаводская ул., 26",55.7064943785236,37.6321237476071,Тульская,6,20,43.05,10.6,18.7,2024,unknown,2.85,Во двор,Монолитный,unknown,unknown,unknown,Новостройка,unknown,https://www.cian.ru/sale/flat/305679571/
9500000,"Москва, САО, р-н Молжаниновский, Ленинградское ш., 228к6",55.933232,37.386759,Молжаниново,12,15,24.7,unknown,6.8,2023,Евроремонт,unknown,Во двор,unknown,Нет информации,Нет,unknown,Вторичка,unknown,https://www.cian.ru/sale/flat/304155806/
30910244,"Москва, ЗАО, Рублево-Архангельское микрорайон, Сберсити жилой комплекс, В20 квартал",55.7887728612671,37.3438008900958,Павшино,3,13,54.02,15.1,19.0,2024,Чистовая,3.53,На улицу,Монолитно-кирпичный,unknown,unknown,unknown,Новостройка,Рублево-Архангельское,https://www.cian.ru/sale/flat/291868741/
16500000,"Москва, ЗАО, р-н Кунцево, Рублевское ш., 79",55.738449,37.432609,Молодёжная,13,22,40.0,unknown,10.0,2008,Дизайнерский,unknown,Во двор,unknown,Центральное,Нет,unknown,Вторичка,unknown,https://www.cian.ru/sale/flat/305908801/
34000000,"Москва, ЗАО, р-н Очаково-Матвеевское, Нежинская ул., 5к2",55.714506,37.474695,Давыдково,4,26,46.0,unknown,unknown,2021,Без ремонта,3.1,Во двор,Монолитный,Центральное,Нет,unknown,Вторичка,unknown,https://www.cian.ru/sale/flat/287678758/
21103320,"Москва, ЗАО, Рублево-Архангельское микрорайон, Сберсити жилой комплекс, В14 квартал",55.7907334001236,37.3426072432844,Павшино,6,9,44.4,14.4,16.1,2026,"Без отделки, чистовая",3.0,На улицу,Монолитно-кирпичный,unknown,unknown,unknown,Новостройка,Рублево-Архангельское,https://www.cian.ru/sale/flat/306151867/
11500000,"Москва, СВАО, р-н Северное Медведково, ул. Тихомирова, 5",55.884858,37.647828,Медведково,14,14,37.0,20.0,8.0,2004,Косметический,2.74,Во двор,Панельный,Центральное,Нет,unknown,Вторичка,unknown,https://www.cian.ru/sale/flat/304785312/
7100000,"Московская область, Балашиха, мкр. Железнодорожный, ул. Поликахина, 3",55.739894,38.005079,Железнодорожная,4,19,37.7,19.0,9.7,2017,Евроремонт,2.74,Во двор,Монолитный,Центральное,Нет,unknown,Вторичка,unknown,https://balashikha.cian.ru/sale/flat/307026558/
95634000,"Москва, ЦАО, р-н Якиманка, Софийская наб., 34С3",55.7463922322426,37.622796830688,Новокузнецкая,2,6,48.3,unknown,unknown,2026,Без отделки,3.03,На улицу,Монолитный,unknown,unknown,unknown,Новостройка,Hutton Development,https://www.cian.ru/sale/flat/304286459/
7400000,"Московская область, Королев, мкр. Костино, проезд Макаренко, 3",55.916027,37.863504,Медведково,10,24,41.0,16.7,10.4,2008,Косметический,2.8,На улицу,Кирпичный,Центральное,Нет,unknown,Вторичка,unknown,https://korolev.cian.ru/sale/flat/304247042/
95000000,"Москва, ЦАО, р-н Пресненский, 1-й Красногвардейский проезд, 15",55.75052,37.539401,Деловой центр,51,75,123.0,69.0,15.0,2013,Дизайнерский,unknown,На улицу,Монолитный,Нет информации,Нет,unknown,Вторичка / Апартаменты,unknown,https://www.cian.ru/sale/flat/297087850/
55770000,"Москва, ЦАО, р-н Хамовники, Коллекция Лужники жилой комплекс",55.7156081703927,37.5715492461217,Воробьёвы горы,7,18,49.8,11.3,unknown,2026,"Без отделки, предчистовая",3.25,unknown,Монолитный,unknown,unknown,unknown,Новостройка,Absolute Premium,https://www.cian.ru/sale/flat/304065730/
5500000,"Московская область, Королев, мкр. Завокзальный, Садовая ул., 9",55.930045,37.816962,Медведково,2,5,32.0,18.0,6.0,1960,Косметический,2.5,На улицу,Кирпичный,Центральное,Нет,unknown,Вторичка,unknown,https://korolev.cian.ru/sale/flat/304694342/
4480000,"Московская область, Королев, мкр. Завокзальный, Садовая ул., 5",55.928491,37.816765,Медведково,1,5,31.6,18.5,6.5,1959,Без ремонта,2.6,На улицу,Кирпичный,Центральное,Нет,unknown,Вторичка,unknown,https://korolev.cian.ru/sale/flat/304688892/
38190900,"Москва, ЦАО, р-н Замоскворечье, Шлюзовая наб., 2/1С1",55.732464,37.642312,Павелецкая,4,8,48.9,24.2,9.7,2028,Без отделки,3.3,Во двор,Монолитный,unknown,unknown,unknown,Новостройка,Галс-Девелопмент,https://www.cian.ru/sale/flat/306687240/
58990000,"Москва, ЦАО, р-н Замоскворечье, Садовническая ул., 57С1",55.740558,37.640929,Новокузнецкая,2,7,65.8,48.5,8.0,2016,Дизайнерский,unknown,Во двор,Монолитный,Нет информации,Нет,unknown,Вторичка / Апартаменты,unknown,https://www.cian.ru/sale/flat/306282663/
21900000,"Москва, СЗАО, р-н Хорошево-Мневники, ул. Шеногина",55.7678921932403,37.5037184490736,Хорошёво,6,20,39.6,16.3,13.6,2024,Чистовая,unknown,На улицу,Монолитный,unknown,unknown,unknown,Новостройка,unknown,https://www.cian.ru/sale/flat/291448184/
19172630,"Москва, ЮАО, р-н Даниловский, Эра жилой комплекс, 1",55.72013197209565,37.64497606666403,Пролетарская,8,27,28.1,15.6,unknown,2026,"Без отделки, предчистовая",3.15,unknown,Монолитный,unknown,unknown,unknown,Новостройка,TEKTA GROUP,https://www.cian.ru/sale/flat/306368174/
90000000,"Москва, ЦАО, р-н Пресненский, 1-й Красногвардейский проезд, 22",55.751366,37.536517,Деловой центр,63,66,86.0,18.0,40.0,unknown,Дизайнерский,unknown,unknown,unknown,unknown,unknown,unknown,Вторичка / Апартаменты,unknown,https://www.cian.ru/sale/flat/299723346/
5599999,"Московская область, Балашиха, ул. Яганова, 12",55.832348,37.956318,Щёлковская,9,25,32.6,17.0,10.0,2022,Евроремонт,2.75,Во двор,unknown,Нет информации,Нет,unknown,Вторичка,unknown,https://balashikha.cian.ru/sale/flat/298166315/
49060000,"Москва, ЦАО, р-н Пресненский, 1-й Красногвардейский проезд, 22с1",55.751138,37.533742,Москва,49,66,44.6,unknown,unknown,2020,"Без отделки, чистовая",3.9,На улицу,Монолитный,unknown,unknown,unknown,Новостройка / Апартаменты,СТ Тауэрс,https://www.cian.ru/sale/flat/304453140/
7449000,"Московская область, Балашиха, мкр. Южный, ул. Твардовского, 26",55.794492,37.982154,Новокосино,14,17,45.3,21.9,10.9,2007,Евроремонт,3.0,На улицу,unknown,Центральное,Нет,unknown,Вторичка,unknown,https://balashikha.cian.ru/sale/flat/304384217/
139410000,"Москва, ЦАО, р-н Якиманка, Лаврушинский жилой комплекс",55.7396737042422,37.6219303055568,Третьяковская,2,14,72.6,14.2,31.0,2024,Без отделки,3.35,unknown,Монолитный,unknown,unknown,unknown,Новостройка,Sminex,https://www.cian.ru/sale/flat/293713671/
15990000,"Москва, СВАО, р-н Марьина роща, Стрелецкая ул., 9К2",55.796835,37.60381,Марьина Роща,9,14,40.0,21.0,9.0,1989,Дизайнерский,2.65,Во двор,Панельный,Центральное,Нет,unknown,Вторичка,unknown,https://www.cian.ru/sale/flat/306409711/
